train,stations
train_1,"[Castricum, Zaandam, Hoorn, Alkmaar]"
train_2,"[Hoorn, Zaandam, Beverwijk, Castricum, Alkmaar]"
train_3,"[Beverwijk, Zaandam, Castricum, Alkmaar, Hoorn]"
train_4,"[Rotterdam Centraal, Schiedam Centrum, Delft, Den Haag Centraal, Gouda, Alphen a/d Rijn, Leiden Centraal, Heemstede-Aerdenhout, Haarlem, Beverwijk]"
train_5,"[Amsterdam Zuid, Amsterdam Sloterdijk, Haarlem, Beverwijk, Zaandam, Hoorn, Alkmaar]"
train_6,"[Zaandam, Amsterdam Sloterdijk, Amsterdam Centraal, Amsterdam Amstel, Amsterdam Zuid, Schiphol Airport, Leiden Centraal, Den Haag Centraal, Gouda, Rotterdam Alexander, Rotterdam Centraal, Schiedam Centrum, Delft]"
score,8140.714285714286