train,stations
train_1,"[Castricum, Beverwijk, Zaandam, Hoorn, Alkmaar]"
train_2,"[Amsterdam Centraal, Amsterdam Amstel, Amsterdam Zuid, Amsterdam Sloterdijk, Zaandam, Beverwijk, Castricum, Alkmaar, Hoorn]"
train_3,"[Amsterdam Amstel, Amsterdam Zuid, Schiphol Airport, Leiden Centraal, Heemstede-Aerdenhout, Haarlem, Amsterdam Sloterdijk, Amsterdam Centraal]"
train_4,"[Alphen a/d Rijn, Gouda, Rotterdam Alexander, Rotterdam Centraal, Dordrecht]"
train_5,"[Haarlem, Beverwijk, Zaandam, Amsterdam Sloterdijk, Amsterdam Zuid, Amsterdam Amstel, Amsterdam Centraal]"
train_6,"[Hoorn, Alkmaar, Den Helder]"
train_7,"[Zaandam, Beverwijk, Castricum, Alkmaar, Den Helder]"
score,7684.571428571429