train,stations
train_1,"[Weert, Roermond, Sittard, Heerlen]"
train_2,"[Zwolle, Assen, Groningen, Leeuwarden, Heerenveen, Steenwijk]"
train_3,"[Amsterdam Amstel, Amsterdam Zuid, Amsterdam Sloterdijk, Zaandam, Castricum, Alkmaar, Hoorn]"
train_4,"[Alkmaar, Hoorn, Zaandam, Amsterdam Sloterdijk, Amsterdam Zuid, Schiphol Airport, Utrecht Centraal, Gouda, Rotterdam Alexander, Rotterdam Centraal, Schiedam Centrum, Rotterdam Blaak, Dordrecht]"
train_5,"[Castricum, Alkmaar, Den Helder]"
train_6,"[Dordrecht, Rotterdam Centraal, Rotterdam Alexander, Rotterdam Blaak, Schiedam Centrum, Delft, Den Haag Centraal, Leiden Centraal, Schiphol Airport, Amsterdam Zuid, Amsterdam Sloterdijk, Amsterdam Centraal, Amsterdam Amstel, Almere Centrum]"
train_7,"[Amsterdam Centraal, Amsterdam Amstel, Hilversum, Utrecht Centraal, Ede-Wageningen, Arnhem Centraal, Dieren, Zutphen, Apeldoorn, Amersfoort]"
train_8,"[Lelystad Centrum, Almere Centrum, Amsterdam Centraal, Amsterdam Sloterdijk, Zaandam, Beverwijk, Castricum, Alkmaar, Den Helder]"
train_9,"[Amsterdam Sloterdijk, Amsterdam Centraal, Utrecht Centraal, Alphen a/d Rijn, Leiden Centraal, Den Haag Laan v NOI, Gouda, Rotterdam Alexander, Rotterdam Centraal, Dordrecht, Rotterdam Blaak, Schiedam Centrum, Delft]"
train_10,"[Lelystad Centrum, Almere Centrum, Hilversum, Amsterdam Amstel, Amsterdam Centraal, Utrecht Centraal, Ede-Wageningen, Arnhem Centraal, Nijmegen, Oss, s-Hertogenbosch]"
train_11,"[Vlissingen, Roosendaal, Etten-Leur, Breda, Dordrecht, Rotterdam Centraal, Rotterdam Alexander, Gouda, Den Haag Centraal, Leiden Centraal, Den Haag HS]"
train_12,"[Maastricht, Sittard, Roermond, Weert, Eindhoven, Helmond, Venlo]"
train_13,"[Heerenveen, Leeuwarden, Groningen, Assen, Zwolle, Steenwijk]"
train_14,"[Almelo, Hengelo, Enschede]"
train_15,"[s-Hertogenbosch, Tilburg, Breda, Etten-Leur, Roosendaal, Vlissingen]"
train_16,"[s-Hertogenbosch, Tilburg, Eindhoven, Helmond, Venlo]"
train_17,"[Apeldoorn, Amersfoort, Zwolle, Almelo, Hengelo, Enschede]"
train_18,"[Arnhem Centraal, Ede-Wageningen, Utrecht Centraal, Amsterdam Centraal, Amsterdam Sloterdijk, Zaandam, Beverwijk, Castricum, Alkmaar, Den Helder]"
train_19,"[Gouda, Den Haag Laan v NOI, Leiden Centraal, Den Haag Centraal, Delft, Den Haag HS]"
train_20,"[Almere Centrum, Amsterdam Amstel, Amsterdam Centraal, Amsterdam Sloterdijk, Haarlem, Heemstede-Aerdenhout, Leiden Centraal, Den Haag Laan v NOI, Delft, Den Haag HS, Gouda, Alphen a/d Rijn, Utrecht Centraal]"
score,4502.404494382023