train,stations
train_1,"[Arnhem Centraal, Ede-Wageningen, Utrecht Centraal, Amsterdam Amstel, Almere Centrum, Hilversum]"
train_2,"[Assen, Zwolle, Almelo, Hengelo, Enschede]"
train_3,"[Oss, s-Hertogenbosch, Tilburg, Eindhoven, Helmond, Venlo]"
train_4,"[Oss, s-Hertogenbosch, Utrecht Centraal, Alphen a/d Rijn, Gouda, Den Haag Laan v NOI, Delft, Den Haag Centraal, Leiden Centraal, Heemstede-Aerdenhout, Haarlem, Amsterdam Sloterdijk]"
train_5,"[Apeldoorn, Deventer, Zwolle, Steenwijk, Heerenveen, Leeuwarden, Groningen, Assen]"
train_6,"[Venlo, Helmond, Eindhoven, Weert, Roermond, Sittard, Maastricht]"
train_7,"[Almere Centrum, Lelystad Centrum]"
train_8,"[Almere Centrum, Amsterdam Centraal, Amsterdam Sloterdijk, Amsterdam Zuid, Amsterdam Amstel, Hilversum, Utrecht Centraal, s-Hertogenbosch, Eindhoven, Helmond, Venlo]"
train_9,"[Den Haag Centraal, Leiden Centraal, Heemstede-Aerdenhout, Haarlem, Beverwijk, Zaandam, Hoorn, Alkmaar, Den Helder]"
train_10,"[Zaandam, Castricum, Beverwijk, Haarlem, Amsterdam Sloterdijk, Amsterdam Centraal, Utrecht Centraal, Alphen a/d Rijn, Leiden Centraal, Schiphol Airport, Amsterdam Zuid, Amsterdam Amstel]"
train_11,"[Leiden Centraal, Den Haag Laan v NOI, Delft, Den Haag HS, Gouda, Den Haag Centraal]"
train_12,"[Beverwijk, Zaandam, Amsterdam Sloterdijk, Amsterdam Centraal, Amsterdam Amstel, Amsterdam Zuid, Schiphol Airport, Utrecht Centraal, Alphen a/d Rijn, Leiden Centraal, Den Haag Centraal, Gouda, Rotterdam Alexander]"
train_13,"[Sittard, Roermond, Weert, Eindhoven, s-Hertogenbosch, Utrecht Centraal, Ede-Wageningen, Arnhem Centraal, Dieren, Zutphen, Apeldoorn, Deventer]"
train_14,"[Rotterdam Alexander, Rotterdam Blaak, Dordrecht, Roosendaal, Etten-Leur, Breda, Tilburg, Eindhoven, Helmond, Venlo]"
train_15,"[Helmond, Eindhoven, s-Hertogenbosch, Oss, Nijmegen, Arnhem Centraal, Dieren, Zutphen, Deventer, Apeldoorn, Amersfoort, Utrecht Centraal, Alphen a/d Rijn]"
train_16,"[Schiedam Centrum, Delft, Den Haag Laan v NOI, Gouda, Rotterdam Alexander, Rotterdam Centraal, Dordrecht, Roosendaal, Vlissingen]"
train_17,"[Eindhoven, Helmond, Venlo]"
train_18,"[Dordrecht, Rotterdam Centraal, Rotterdam Alexander, Rotterdam Blaak, Schiedam Centrum, Delft, Den Haag Centraal, Leiden Centraal, Den Haag HS, Gouda, Utrecht Centraal, Hilversum, Almere Centrum]"
train_19,"[Rotterdam Blaak, Dordrecht, Breda, Etten-Leur, Roosendaal, Vlissingen]"
train_20,"[Zaandam, Castricum, Alkmaar, Den Helder]"
score,5056.561797752809