train,stations
train_1,"[Heemstede-Aerdenhout, Leiden Centraal, Alphen a/d Rijn, Gouda, Rotterdam Alexander, Rotterdam Centraal, Schiedam Centrum, Delft, Den Haag Centraal]"
train_2,"[Amsterdam Amstel, Amsterdam Centraal, Amsterdam Sloterdijk, Amsterdam Zuid, Schiphol Airport, Leiden Centraal, Den Haag Centraal, Gouda, Rotterdam Alexander, Rotterdam Centraal, Schiedam Centrum, Delft]"
train_3,"[Schiedam Centrum, Delft, Den Haag Centraal, Gouda, Rotterdam Alexander, Rotterdam Centraal, Dordrecht]"
train_4,"[Leiden Centraal, Den Haag Centraal, Delft, Schiedam Centrum, Rotterdam Centraal]"
train_5,"[Amsterdam Zuid, Schiphol Airport, Leiden Centraal, Heemstede-Aerdenhout, Haarlem, Amsterdam Sloterdijk, Amsterdam Centraal, Amsterdam Amstel]"
train_6,"[Amsterdam Centraal, Amsterdam Sloterdijk, Haarlem, Beverwijk, Zaandam, Castricum, Alkmaar]"
train_7,"[Amsterdam Sloterdijk, Zaandam, Hoorn, Alkmaar]"
score,7718.571428571429