train,stations
train_1,"[Heemstede-Aerdenhout, Leiden Centraal, Alphen a/d Rijn, Gouda, Rotterdam Alexander, Rotterdam Centraal, Dordrecht]"
train_2,"[Alkmaar, Den Helder]"
train_3,"[Zaandam, Castricum, Beverwijk, Haarlem, Amsterdam Sloterdijk, Amsterdam Zuid, Amsterdam Amstel, Amsterdam Centraal]"
train_4,"[Gouda, Rotterdam Alexander, Rotterdam Centraal, Schiedam Centrum, Delft, Den Haag Centraal, Leiden Centraal, Schiphol Airport, Amsterdam Zuid, Amsterdam Amstel, Amsterdam Centraal, Amsterdam Sloterdijk, Haarlem]"
train_5,"[Dordrecht, Rotterdam Centraal, Schiedam Centrum, Delft, Den Haag Centraal, Gouda, Alphen a/d Rijn, Leiden Centraal, Heemstede-Aerdenhout, Haarlem]"
train_6,"[Amsterdam Sloterdijk, Zaandam, Hoorn, Alkmaar, Den Helder]"
train_7,"[Hoorn, Alkmaar, Castricum, Zaandam, Amsterdam Sloterdijk, Amsterdam Centraal, Amsterdam Amstel, Amsterdam Zuid, Schiphol Airport, Leiden Centraal, Heemstede-Aerdenhout, Haarlem]"
score,8309.857142857143